{"schema":"chancadem.surrogate/v1","engine_version":"0.09.003","machine_order":["cone-sec","cone-tert","jaw","cone-short-head","gyratory"],"input_order":["css_mm","throw_mm","speed_rpm","feed_x63_mm","feed_m","ore_axb"],"in_mean":[59.12966537475586,26.003122329711914,355.6756896972656,188.49363708496094,1.313321590423584,70.57135009765625],"in_std":[56.631683349609375,10.287561416625977,135.84506225585938,198.72792053222656,0.33907583355903625,22.795068740844727],"output_order":["p80_mm","p50_mm","p20_mm","pass_1","pass_4","pass_8","pass_16","pass_32","throughput_tph","power_kw"],"out_log":[true,true,true,false,false,false,false,false,false,false],"out_mean":[1.467167615890503,1.1436902284622192,0.448967844247818,0.15786579251289368,0.3134826123714447,0.44715023040771484,0.593015193939209,0.6932022571563721,1062.06591796875,175.29615783691406],"out_std":[0.547846794128418,0.5997057557106018,0.715634822845459,0.11960113048553467,0.23100346326828003,0.31256452202796936,0.3597903251647949,0.3327787518501282,1354.9217529296875,87.6966781616211],"graphs":{"float32":{"path":"models/surrogate.onnx","bytes":32449,"sha256":"43c4681f089fe64ceac97d816a2585da72920661cf085469844f55bf440eeaf4","opset":17,"input":"x","output":"y"},"int8":{"path":"models/surrogate.int8.onnx","bytes":15880,"sha256":"a55bd4da1a63bd1213eb322ddef9e96125d52558ebea1de62265c435066cc898","opset":17,"input":"x","output":"y"}},"architecture":"11-64-64-32-10 MLP (release 0.09.003)","training":{"seed":42,"n_train":6430,"n_test":2196,"sampler":"the Latin-hypercube sweep of release 0.09.003 (Node, over the TypeScript engine)","torch_version":"2.12.1"}}
