{"schema":"chancadem.surrogate/v1","engine_version":"0.10.000","machine_order":["cone-sec","cone-tert","jaw","cone-short-head","gyratory"],"input_order":["css_mm","throw_mm","speed_rpm","feed_x63_mm","feed_m","ore_axb"],"in_mean":[59.129859924316406,26.00315284729004,355.6749267578125,188.49380493164062,1.3133207559585571,70.57136535644531],"in_std":[56.631690979003906,10.287569046020508,135.8450469970703,198.72787475585938,0.33907583355903625,22.795095443725586],"output_order":["p80_mm","p50_mm","p20_mm","pass_1","pass_4","pass_8","pass_16","pass_32","throughput_tph","power_kw"],"out_log":[true,true,true,false,false,false,false,false,false,false],"out_mean":[1.4671683311462402,1.143690586090088,0.44896817207336426,0.15786591172218323,0.3134828209877014,0.4471508860588074,0.5930156111717224,0.6932020783424377,1062.067138671875,175.29640197753906],"out_std":[0.5478469133377075,0.5997059941291809,0.7156350612640381,0.11960110813379288,0.23100337386131287,0.3125646412372589,0.35978826880455017,0.3327810764312744,1354.9222412109375,87.69664764404297],"graphs":{"float32":{"path":"models/surrogate.onnx","bytes":32449,"sha256":"233024c3fb93e24ea44b050a25c1f15dedf70d1fe7cf880063d4a4261957b101","opset":17,"input":"x","output":"y"},"int8":{"path":"models/surrogate.int8.onnx","bytes":15880,"sha256":"34f70a8dca3b3503132a0c34fb31f96170de909603ac127294f75429921edcce","opset":17,"input":"x","output":"y"}},"architecture":"11-64-64-32-10 MLP, GELU; Adam 2e-3, weight decay 1e-5, 500 full-batch epochs, MSE in z-space","training":{"seed":12345,"n_train":6430,"n_test":2196,"sampler":"Latin-hypercube sweep of the canonical Python engine, 1400 points per machine (seed 12345, mulberry32), each machine over its own ranges (cone-sec: css_mm 6 to 90, throw_mm 16 to 44, speed_rpm 180 to 560, feed_x63_mm 40 to 200, feed_m 0.7 to 2, ore_axb 30 to 110; cone-tert: css_mm 4 to 22, throw_mm 10 to 26, speed_rpm 220 to 600, feed_x63_mm 15 to 55, feed_m 0.9 to 2, ore_axb 30 to 110; jaw: css_mm 50 to 160, throw_mm 24 to 50, speed_rpm 180 to 380, feed_x63_mm 180 to 500, feed_m 0.7 to 1.6, ore_axb 35 to 110; cone-short-head: css_mm 4 to 16, throw_mm 10 to 22, speed_rpm 380 to 600, feed_x63_mm 15 to 45, feed_m 0.9 to 2, ore_axb 30 to 110; gyratory: css_mm 120 to 240, throw_mm 22 to 40, speed_rpm 100 to 200, feed_x63_mm 300 to 800, feed_m 0.7 to 1.4, ore_axb 30 to 110); ore_wi = clamp(8 + (120 - ore_axb) * 0.09, 8, 20); degenerate draws dropped; the held-out draw is an independent second Latin-hypercube draw of 480 points per machine (seed 67890)","torch_version":"2.12.1","export_parity_max_abs":1.66893e-06}}